{
  "schema_version": 1,
  "domain": "Project Management",
  "reviewed_against": {
    "git_commit": "0123456789abcdef0123456789abcdef01234567",
    "registry_sha256": "sha256:0123456789abcdef0123456789abcdef0123456789abcdef0123456789abcdef",
    "catalog_release": "capability-v2-2026-08-11",
    "catalog_sha256": "sha256:abcdef0123456789abcdef0123456789abcdef0123456789abcdef0123456789"
  },
  "function_dispositions": {
    "rest:GET:/api/projects": {
      "resolution": "existing_capability",
      "target_capability": "project.project.list",
      "source_paths": ["backend/routers/projects.py"],
      "evidence": null,
      "reason": null,
      "classification": null
    }
  },
  "capability_candidates": {
    "project.project.create": {
      "business_outcome": "Create a project with the caller's supplied planning metadata.",
      "resolution": "new_capability",
      "non_goals": ["Do not expose consumer-specific project creation code."],
      "source_function_ids": {
        "rest:POST:/api/projects": {
          "resolution": "new_capability",
          "source_paths": ["backend/routers/projects.py"],
          "owner": "project-management-owner",
          "evidence": "The route creates the Project aggregate from user input.",
          "reviewer": "project-management-owner",
          "reviewed_at": "2026-08-11"
        }
      },
      "owner_domain": "project_management",
      "application_port": "project_management.create_project",
      "provider_artifact": "official.project-management",
      "owned_tables": ["projects"],
      "migration_stream": "project_management",
      "consumer_exposure_ref": {
        "shared_pipeline": "capability_provider_gateway",
        "web": {"enabled": true, "reason": "Project creation is available in the web workspace.", "policy_ref": "project.create"},
        "rest": {"enabled": true, "reason": "The REST gateway exposes the shared capability.", "policy_ref": "project.create"},
        "plugin": {"enabled": true, "reason": "Plugins invoke the same governed project operation.", "policy_ref": "project.create"},
        "agent": {"enabled": true, "reason": "Agents invoke the same governed project operation.", "policy_ref": "project.create"},
        "mcp": {"enabled": false, "reason": "MCP exposure awaits an approved tool policy decision.", "policy_ref": "project.create"},
        "local_runtime": {"enabled": false, "reason": "This business operation has no local-runtime transport need.", "policy_ref": "project.create"}
      },
      "delivery_pipeline": "capability_provider_gateway"
    }
  },
  "consumer_exposures": {
    "existing_catalog_capabilities": {
      "project.project.list": {
        "shared_pipeline": "capability_provider_gateway",
        "web": {"enabled": true, "reason": "Project listing is available in the web workspace.", "policy_ref": "project.list"},
        "rest": {"enabled": true, "reason": "The REST gateway exposes the existing capability.", "policy_ref": "project.list"},
        "plugin": {"enabled": true, "reason": "Plugins invoke the same governed list operation.", "policy_ref": "project.list"},
        "agent": {"enabled": true, "reason": "Agents invoke the same governed list operation.", "policy_ref": "project.list"},
        "mcp": {"enabled": false, "reason": "MCP exposure awaits an approved tool policy decision.", "policy_ref": "project.list"},
        "local_runtime": {"enabled": false, "reason": "This read operation has no local-runtime transport need.", "policy_ref": "project.list"}
      }
    }
  },
  "code_extractions": [
    {
      "id": "project-create-shared-provider",
      "source_paths": ["backend/routers/projects.py"],
      "owner_domain": "project_management",
      "target_application_port": "project_management.create_project",
      "shared_pipeline": "capability_provider_gateway",
      "disposition": "planned"
    }
  ],
  "database_boundaries": [
    {
      "table": "projects",
      "owner_domain": "project_management",
      "access_mode": "write",
      "migration_stream": "project_management",
      "evidence": "Project creation writes the projects aggregate table."
    }
  ],
  "debt_dispositions": [
    {
      "id": "project-create-router-debt",
      "category": "consumer_adapter",
      "source_paths": ["backend/routers/projects.py"],
      "owner_domain": "project_management",
      "disposition": "remove_after_extraction",
      "reason": "The route delegates only after the shared provider is extracted."
    }
  ],
  "review": {
    "reviewer": "project-management-owner",
    "reviewed_at": "2026-08-11",
    "status": "draft"
  }
}
